{
  "format": "trestle-plan",
  "version": 1,
  "state": "planned",
  "generator": {
    "name": "trestle",
    "version": "0.0.0-test"
  },
  "catalog": {
    "baseline": "olai-stack-topology@test",
    "manifests": [],
    "digest": "sha256:b51fab9b3d3bea840fb8b899d1ae7800fae6fa8a253d003d82acb116a7a0d06b"
  },
  "recipe": {
    "digest": "sha256:8a4c788b697c0a513206f8ffe7c69b1a47a315b1cb39a5028f564d4a4b17dad6"
  },
  "context": {
    "env_name": "uc-docs",
    "target": "compose",
    "gateway_service": "envoy",
    "gateway_internal_port": 10000,
    "gateway_host_port": 8080,
    "gateway_admin_port": 9901,
    "dedicated_listener_ports": [],
    "dedicated_listener_port_base": 9100,
    "provider_preference": {},
    "data_root": "./.data",
    "local_secrets": "inline"
  },
  "graph": {
    "nodes": [
      {
        "id": "@clients",
        "model": null,
        "kind": "clients",
        "display_name": "Clients",
        "summary": "Browsers, SDKs and CLIs on the host.",
        "category": null,
        "role": null,
        "placement": null,
        "cloud": null,
        "surfaces": [],
        "offers": [],
        "provisions": [],
        "resource_nouns": []
      },
      {
        "id": "envoy",
        "model": "envoy",
        "kind": "gateway",
        "display_name": "Envoy",
        "summary": "Single-port gateway, Databricks-shaped URL rewrites.",
        "category": "gateway",
        "role": "gateway",
        "placement": "container:envoy",
        "cloud": null,
        "surfaces": [
          {
            "host_port": 8080,
            "kind": "platform",
            "protocols": [],
            "exposes": [
              {
                "module": "unity-catalog",
                "endpoint": "rest",
                "kind": "api",
                "prefix": "/api/2.1/unity-catalog",
                "gated": false
              },
              {
                "module": "unity-catalog",
                "endpoint": "rest_alias",
                "kind": "api",
                "prefix": "/unity-catalog",
                "gated": false
              }
            ]
          }
        ],
        "offers": [],
        "provisions": [],
        "resource_nouns": []
      },
      {
        "id": "unity-catalog",
        "model": "unityCatalogOSS",
        "kind": "component",
        "display_name": "Unity Catalog",
        "summary": "Open-source Unity Catalog server; Databricks-shaped REST API.",
        "category": "catalog",
        "role": "data_catalog",
        "placement": "container:unitycatalog",
        "cloud": null,
        "surfaces": [],
        "offers": [],
        "provisions": [],
        "resource_nouns": []
      }
    ],
    "edges": [
      {
        "kind": "access",
        "key": "access:@clients→envoy:8080",
        "from": "@clients",
        "to": "envoy",
        "host_port": 8080
      },
      {
        "kind": "route",
        "key": "route:envoy→unity-catalog:8080",
        "from": "envoy",
        "to": "unity-catalog",
        "host_port": 8080,
        "gated": false
      }
    ]
  },
  "containers": [
    {
      "name": "envoy",
      "component": "envoy",
      "kind": "service"
    },
    {
      "name": "gateway-certs",
      "component": "envoy",
      "kind": "init"
    },
    {
      "name": "unitycatalog",
      "component": "unity-catalog",
      "kind": "service"
    }
  ],
  "services": {
    "envoy": [
      {
        "name": "envoy",
        "role": "gateway",
        "placement": {
          "kind": "container",
          "service": "envoy"
        },
        "endpoints": [
          {
            "id": "http",
            "scheme": "http",
            "internal_port": 10000,
            "host_port": 9080,
            "intent": {
              "kind": "internal"
            },
            "rewrite": "inherit"
          }
        ],
        "depends_on": []
      }
    ],
    "unity-catalog": [
      {
        "name": "unitycatalog",
        "role": "data_catalog",
        "placement": {
          "kind": "container",
          "service": "unitycatalog"
        },
        "endpoints": [
          {
            "id": "rest",
            "scheme": "http",
            "internal_port": 8080,
            "intent": {
              "kind": "api"
            },
            "mount_prefix": "/api/2.1/unity-catalog",
            "rewrite": "inherit"
          },
          {
            "id": "rest_alias",
            "scheme": "http",
            "internal_port": 8080,
            "intent": {
              "kind": "api"
            },
            "mount_prefix": "/unity-catalog",
            "rewrite": "inherit"
          }
        ],
        "depends_on": []
      }
    ]
  },
  "gateway": {
    "listeners": [
      {
        "host_port": 8080,
        "routes": [
          {
            "prefix": "/api/2.1/unity-catalog",
            "cluster": "unitycatalog",
            "rewrite": null
          },
          {
            "prefix": "/unity-catalog",
            "cluster": "unitycatalog",
            "rewrite": null
          }
        ]
      }
    ],
    "clusters": [
      {
        "name": "unitycatalog",
        "host": "unitycatalog",
        "port": 8080
      }
    ],
    "admin_port": 9901,
    "auth": null,
    "tls": null,
    "policy": null
  },
  "client": {
    "host": {
      "UNITY_CATALOG_URL": "http://localhost:8080/api/2.1/unity-catalog"
    },
    "container": {
      "UNITY_CATALOG_URL": "http://envoy:10000/api/2.1/unity-catalog"
    }
  },
  "files": [
    {
      "path": "compose.yaml",
      "sensitive": false
    },
    {
      "path": ".env",
      "sensitive": false
    },
    {
      "path": ".gitignore",
      "sensitive": false
    },
    {
      "path": "client/host.env",
      "sensitive": false
    },
    {
      "path": "client/container.env",
      "sensitive": false
    },
    {
      "path": "LAYOUT.md",
      "sensitive": false
    },
    {
      "path": "modules/envoy/envoy.yaml",
      "sensitive": false
    },
    {
      "path": "modules/envoy/compose.yaml",
      "sensitive": false
    },
    {
      "path": "modules/unity-catalog/compose.yaml",
      "sensitive": false
    },
    {
      "path": "modules/unity-catalog/secrets/server.properties",
      "sensitive": false
    }
  ]
}
